{
  "schema_version": "1.0",
  "source": {
    "uri": "https://youtu.be/izMBiWG3L24",
    "type": "yt-dlp",
    "title": "SVG to React: Turning Illustrator Designs into Web Animations with Claude Code",
    "duration_s": 718.654,
    "width": 1280,
    "height": 720,
    "fps": 30.00001391530865,
    "codec": "vp9"
  },
  "run": {
    "run_id": "a8827daf934b",
    "generated_at": "2026-06-28T01:28:17Z",
    "tool_version": "a1.0",
    "host_os": "windows",
    "download_s": 11.297000000020489,
    "processing_s": 120.04699999996228,
    "wall_clock_s": 131.34399999998277
  },
  "transcription": {
    "path": "whisperx",
    "model": "large-v3",
    "diarization": "off",
    "diarization_reason": "auto_single_speaker",
    "language": "en",
    "speaker_count": 0
  },
  "frames": [
    {
      "index": 0,
      "timestamp_s": 0.0,
      "file": "frame_0001_000000.jpg",
      "is_scene_cut": false,
      "phash": "c00052d25ad25a303bbf25a52dafad2d2f6dad292dff25823fab8c280f2dada1",
      "sharpness": 371.028
    },
    {
      "index": 1,
      "timestamp_s": 1.0,
      "file": "frame_0002_000001.jpg",
      "is_scene_cut": false,
      "phash": "c00052d25ad25a103bbf25852dafad2d2f6dad292dff258237af8e290f2dada1",
      "sharpness": 376.36
    },
    {
      "index": 2,
      "timestamp_s": 2.0,
      "file": "frame_0003_000002.jpg",
      "is_scene_cut": false,
      "phash": "c00052d25ad25a302ebf25a52dafad2d2f6dad692dff258226ef8e290f2da9a1",
      "sharpness": 374.713
    },
    {
      "index": 3,
      "timestamp_s": 4.0,
      "file": "frame_0004_000004.jpg",
      "is_scene_cut": false,
      "phash": "d0005ad25a7672d22dbfa3252dadadad2dedad192dbb8d884d8925892da98da9",
      "sharpness": 277.142
    },
    {
      "index": 4,
      "timestamp_s": 5.0,
      "file": "frame_0005_000005.jpg",
      "is_scene_cut": false,
      "phash": "c00052d276de58d20dbf8d252d2fad252d6fad6d39eb0c8819ab2ca83babacad",
      "sharpness": 292.576
    },
    {
      "index": 5,
      "timestamp_s": 6.0,
      "file": "frame_0006_000006.jpg",
      "is_scene_cut": false,
      "phash": "d000561652f2667267beb1a12f2d2d6d2fafa9896dcf98984d8b89c92dadac89",
      "sharpness": 321.78
    },
    {
      "index": 6,
      "timestamp_s": 8.0,
      "file": "frame_0007_000008.jpg",
      "is_scene_cut": false,
      "phash": "c00052d25ada52726667a52d2dadad2d2dadad0d2ded89883dabad892dadad8d",
      "sharpness": 319.752
    },
    {
      "index": 7,
      "timestamp_s": 10.0,
      "file": "frame_0008_000010.jpg",
      "is_scene_cut": false,
      "phash": "c00052d25ada5252776725252dadad2d2dfdad492dff2989198bad892dadad89",
      "sharpness": 310.93
    },
    {
      "index": 8,
      "timestamp_s": 12.0,
      "file": "frame_0009_000012.jpg",
      "is_scene_cut": false,
      "phash": "c0005ad252d246466ff7a7653d6db12d2f6dad290fef8e0809abb88839b9a9b9",
      "sharpness": 276.17
    },
    {
      "index": 9,
      "timestamp_s": 13.0,
      "file": "frame_0010_000013.jpg",
      "is_scene_cut": false,
      "phash": "d00052525eda72627f67ad352d6dad652db9ad092fcf098839bb89892dadac89",
      "sharpness": 297.156
    },
    {
      "index": 10,
      "timestamp_s": 14.0,
      "file": "frame_0011_000014.jpg",
      "is_scene_cut": false,
      "phash": "c0005a525ada72226e6f25a52d6da52d2dbd8d4d3d9f98883da93d893dadad89",
      "sharpness": 268.674
    },
    {
      "index": 11,
      "timestamp_s": 16.0,
      "file": "frame_0012_000016.jpg",
      "is_scene_cut": false,
      "phash": "c00052d25af672505fff2565279dad252feda98d0dab2889398f8ca92da9ad8d",
      "sharpness": 292.263
    },
    {
      "index": 12,
      "timestamp_s": 17.0,
      "file": "frame_0013_000017.jpg",
      "is_scene_cut": false,
      "phash": "c00052525ade5292777727652dedad2d2dedada929ab88892eaf8c892d9d8d99",
      "sharpness": 238.708
    },
    {
      "index": 13,
      "timestamp_s": 19.0,
      "file": "frame_0014_000019.jpg",
      "is_scene_cut": false,
      "phash": "d0005ad25ef6721233bfac652deda52d2dadaca92faf89892f898c892dada189",
      "sharpness": 292.601
    },
    {
      "index": 14,
      "timestamp_s": 20.0,
      "file": "frame_0015_000020.jpg",
      "is_scene_cut": false,
      "phash": "c0005ad25af6729877bdad652d6da50d2dfdad692fcf88892ba988a92da9a189",
      "sharpness": 322.866
    },
    {
      "index": 15,
      "timestamp_s": 21.0,
      "file": "frame_0016_000021.jpg",
      "is_scene_cut": false,
      "phash": "c0005ad25af6729a33bdad652defa50d2dadad292faf89892b898c892dada589",
      "sharpness": 319.909
    },
    {
      "index": 16,
      "timestamp_s": 23.0,
      "file": "frame_0017_000023.jpg",
      "is_scene_cut": false,
      "phash": "c00052d256d256726dff25252d2dad2d2dada9293baf998939aba9892dcdad89",
      "sharpness": 256.45
    },
    {
      "index": 17,
      "timestamp_s": 24.0,
      "file": "frame_0018_000024.jpg",
      "is_scene_cut": false,
      "phash": "c00052525a76525267ffa5252dedad2d2dadad892deb098919abac892dadadad",
      "sharpness": 299.09
    },
    {
      "index": 18,
      "timestamp_s": 26.0,
      "file": "frame_0019_000026.jpg",
      "is_scene_cut": false,
      "phash": "c00052d25a7652766f9f252d2d6dad252dadad892deb0c893dab89892dadad8d",
      "sharpness": 312.278
    },
    {
      "index": 19,
      "timestamp_s": 27.0,
      "file": "frame_0020_000027.jpg",
      "is_scene_cut": false,
      "phash": "d000565242d272166f272c392d6daded2dafad293cb98c886deab9892dadad8d",
      "sharpness": 240.486
    },
    {
      "index": 20,
      "timestamp_s": 28.0,
      "file": "frame_0021_000028.jpg",
      "is_scene_cut": false,
      "phash": "c00052d252de727237ff870d2dad252d2faf8d092de929891f8b2da92dad8d8d",
      "sharpness": 326.727
    },
    {
      "index": 21,
      "timestamp_s": 30.0,
      "file": "frame_0022_000030.jpg",
      "is_scene_cut": false,
      "phash": "c00052525ad670760f1f25652feda5e92de98f8b2de989881d8b2da90f9f2dad",
      "sharpness": 348.248
    },
    {
      "index": 22,
      "timestamp_s": 31.0,
      "file": "frame_0023_000031.jpg",
      "is_scene_cut": false,
      "phash": "c00052525ad670760f7f25252feda5692ded8f8b2de988881dab2da90f9f25ad",
      "sharpness": 353.804
    },
    {
      "index": 23,
      "timestamp_s": 33.0,
      "file": "frame_0024_000033.jpg",
      "is_scene_cut": false,
      "phash": "c00052565ade52762f6725252deda5a92dedad892deb89891dab8d892d8dad8d",
      "sharpness": 319.229
    },
    {
      "index": 24,
      "timestamp_s": 35.0,
      "file": "frame_0025_000035.jpg",
      "is_scene_cut": false,
      "phash": "c00052565ada70720e7f25252feda5a92ded8f892de989891dab2da91f8f25ad",
      "sharpness": 384.645
    },
    {
      "index": 25,
      "timestamp_s": 36.0,
      "file": "frame_0026_000036.jpg",
      "is_scene_cut": false,
      "phash": "c00052565ada70f00f3f25652feda5a92de98f892de9898a1dab2ca91f9d2dad",
      "sharpness": 405.737
    },
    {
      "index": 26,
      "timestamp_s": 38.0,
      "file": "frame_0027_000038.jpg",
      "is_scene_cut": false,
      "phash": "e00052565ada70300f3725a52feda5692ded8f8b2de989881fab2da91f8d2dad",
      "sharpness": 407.847
    },
    {
      "index": 27,
      "timestamp_s": 39.0,
      "file": "frame_0028_000039.jpg",
      "is_scene_cut": false,
      "phash": "e000da525ad252627be725a9272f2d250f9f2dad0f1f2c894f9d8d892dad8d8d",
      "sharpness": 390.05
    },
    {
      "index": 28,
      "timestamp_s": 41.0,
      "file": "frame_0029_000041.jpg",
      "is_scene_cut": false,
      "phash": "e000d2525ad252727bf721e52f7f2d250f8f2da90f9f24884d998d892ded8d8d",
      "sharpness": 389.832
    },
    {
      "index": 29,
      "timestamp_s": 42.0,
      "file": "frame_0030_000042.jpg",
      "is_scene_cut": false,
      "phash": "e000d2525ad252727bf721e52f3f2d250f9f2da90f1f25894d898da92dad8d8d",
      "sharpness": 391.495
    },
    {
      "index": 30,
      "timestamp_s": 43.0,
      "file": "frame_0031_000043.jpg",
      "is_scene_cut": false,
      "phash": "e000d2525ad252727bf721e12f7f2d250f9f2da90f1f25894d998d892dad8d8d",
      "sharpness": 389.976
    },
    {
      "index": 31,
      "timestamp_s": 45.0,
      "file": "frame_0032_000045.jpg",
      "is_scene_cut": false,
      "phash": "e000d2525ad252723bf721a92f2f2d250f9f2dad0f1f25894d998da92ded8d8d",
      "sharpness": 385.255
    },
    {
      "index": 32,
      "timestamp_s": 46.0,
      "file": "frame_0033_000046.jpg",
      "is_scene_cut": false,
      "phash": "e000d2525ad252727bf721a52f2f2d250f9f2dad0f1f25894d998d892ded8d8d",
      "sharpness": 392.373
    },
    {
      "index": 33,
      "timestamp_s": 48.0,
      "file": "frame_0034_000048.jpg",
      "is_scene_cut": false,
      "phash": "e000da525ad252623be725a92f2f2d250f9f2dad0f9f24894f998d892ded8d8d",
      "sharpness": 392.142
    },
    {
      "index": 34,
      "timestamp_s": 49.0,
      "file": "frame_0035_000049.jpg",
      "is_scene_cut": false,
      "phash": "e000d2525ad252727bf721a12f2f2da50f9f2dad0f1f25894d998d892ded8d8d",
      "sharpness": 389.534
    },
    {
      "index": 35,
      "timestamp_s": 50.0,
      "file": "frame_0036_000050.jpg",
      "is_scene_cut": false,
      "phash": "e000da525ad252723bf725a52f2f2d250f9f2da90f9f24884f998da92dad8d8d",
      "sharpness": 393.823
    },
    {
      "index": 36,
      "timestamp_s": 52.0,
      "file": "frame_0037_000052.jpg",
      "is_scene_cut": false,
      "phash": "e000da525ad252723bf725e5277d2d250f8f2da90f9f24884f998d892ded8d8d",
      "sharpness": 389.65
    },
    {
      "index": 37,
      "timestamp_s": 53.0,
      "file": "frame_0038_000053.jpg",
      "is_scene_cut": false,
      "phash": "e000d2525af2527239f725a52f2f2d2d0f9f2d290f9f25a94f8b29a10f8dad8d",
      "sharpness": 392.575
    },
    {
      "index": 38,
      "timestamp_s": 55.0,
      "file": "frame_0039_000055.jpg",
      "is_scene_cut": false,
      "phash": "c000527252da5a723fffaca52dafad2d2daf25892deb09880da9ac892dadad8d",